Indian reply to NYtimes cartoon on Paris climate accord by Satish Acharya.,spikyraccoon,1496494045.0,18177,/r/all,imgur.com,'',6f10op
Image Of Smiling Baby For Hyderabad Police Officers Who Rescued Him From The Kidnappers Thrill The Internet,AudraMagnus,1507522088.0,8725,Non-Political,i.redd.it,'',756o9r
Hindu cop standing guard as Muslim comrade offers namaz (photo shared by Srinagar Sector CRPF on Twitter),wordswithmagic,1501494086.0,5626,Non-Political,i.redd.it,'',6qndie
If you still throw garbage on street.,Phuc-Dat_Bich,1494236390.0,5210,Non-Political,i.imgur.com,'',69x3q4
Indian Wonder Woman- Cosplay by Deepica Mutyala,SanskariNari,1509184668.0,4954,Non-Political,i.redd.it,'',799c68
I finally decided to upload my first webcomic [OC],umanghome,1504759310.0,4306,Non-Political,i.imgur.com,'',6yl246
Shilpa Shetty's thoughts on Orwell's 'Animal Farm',Keerikkadan91,1480319845.0,4108,/r/all,i.imgur.com,'',5faipl
Somewhere in Assam,hipporama,1502772429.0,3917,Non-Political,i.imgur.com,'',6ts2fe
Great idea sirji!!,karmalife0,1501754584.0,3758,Non-Political,i.redd.it,'',6rbaho
ToI delivers for a change,ironypatrol,1487308441.0,3703,Non-Political,pbs.twimg.com,'',5ukeuv
Don't call me to your wedding if your bridesmaids aren't dressed like this.,littlejoey362,1508639038.0,3635,Non-Political,i.redd.it,'',77xomz
Harsh reality is we're it,prawncream,1503730113.0,3613,Non-Political,i.imgur.com,'',6w472g
Indians Right Now.,IndianRoyal,1497848667.0,3604,Sports,i.redd.it,'',6i4ded
"A dog wearing sunglasses hitchhiking atop a rickshaw in Mumbai, India",gaganaut,1508172188.0,3496,Non-Political,gfycat.com,'',76rqsz
Grocery shopping list of an Indian wife,SanskariNari,1506238606.0,3428,Non-Political,i.redd.it,'',723t75
Andhra Pradesh should redesign this map/logo,kash_if,1485574692.0,3403,Non-Political,i.imgur.com,'',5qlnwz
An in depth news coverage of the monsoons,,1500952828.0,2996,Non-Political,pbs.twimg.com,'',6pdjyu
Modi: From Nov 8 to abolish 500 and 1000 Rupee notes.,yal_sik,1478616638.0,2910,Policy & Economy,self.india,'',5btlxy
"Dera Sacha Sauda chief Gurmeet Ram Rahim found guilty of rape, taken into judicial custody",_why_so_sirious_,1503653906.0,2822,Politics,timesofindia.indiatimes.com,'',6vxf4r
Rivalry at its classiest,indifferentoyou,1505791024.0,2753,[R]eddiquette,i.redd.it,'',7109bd
/r/India is one of the biggest reasons for where Brown Paperbag is at now. Here are some of my latest comics directly hosted on imgur for all those without a Facebook or Instagram account,Saigo_Digiart,1493119395.0,2695,Original Comics,imgur.com,'',67fwl6
"A member of indian army services corps at Dunkirk, 1940.",OnePunchSenpai,1500875204.0,2674,Non-Political,i.imgur.com,'',6p6hs9
A coconut vendor celebrating Deepavali in Bengaluru !!,rrao115,1508567198.0,2667,Non-Political,i.redd.it,'',77rvfr
Burj Khalifa marks India’s 68th Republic Day with a spectacular LED illumination of our National flag,iNotRobot,1485351241.0,2628,Politics,i.reddituploads.com,'',5q36nu
Bengaluru traffic cop stops President’s convoy to let ambulance pass; wins hearts and reward too,lallulal,1497948009.0,2590,Politics,indianexpress.com,'',6icrxe
"Beef Ban, Demonitsation, Swacch Bharat and Digital India - Modiji's all the achievements in one frame.",ribiy,1501126439.0,2492,Politics,imgur.com,'',6ptd51
"It's a humble request to you all, please don't share this image. You can go to jail.",thealbinoturtle,1500177039.0,2450,Politics,i.redd.it,'',6nk9dm
Right To Privacy is Fundamental Right,babbanbhai,1503551860.0,2449,Politics,ndtv.com,'',6vor32
Bengaluru police at it with the GOT references! [NP],architect_macha,1498301382.0,2398,Non-Political,i.imgur.com,'',6j7k4u
When you have more phones than toilets,dodunichaar,1494822240.0,2304,Politics,i.redd.it,'',6b8byp
Divided by religion,Muneerr,1507006314.0,2220,Non-Political,i.redd.it,'',73yaqa
"Sushma Swaraj with The King, The Queen and The Prince of Bhutan",SanskariNari,1509442491.0,2080,Politics,i.redd.it,'',79un3j
TIL: An Indian will spend one-fifth of this life's earning on a wedding ceremony,wordswithmagic,1493450092.0,2047,Non-Political,businessinsider.in,'',6884un
Hmm,janzboi,1508232861.0,1975,Non-Political,i.imgur.com,'',76xg45
Respect for whoever did this.,aryaninvader,1492827216.0,1964,Non-Political,i.redd.it,'',66tlt2
"Panama Papers - In Pakistan it gets you Disqualified, In India you get to promote GST!",modiusoperandi,1501320563.0,1942,Politics,imgur.com,'',6qa3jt
Killing people in the name of Gau Bhakti is not acceptable: PM Modi,darkdongdong,1498723004.0,1911,Politics,timesofindia.indiatimes.com,'',6k6wqu
How do you know if someone went to IIT? They'll tell you.,laudalasan,1498366852.0,1884,Non-Political,i.imgur.com,'',6jco20
This pic of Mumbai Conservancy workers cleaning gutters.....,,1508383105.0,1860,Non-Political,i.redd.it,'',77bvhj
Do we have any words to describe this picture? - Three Madhya Pradesh policeman attacked the very old woman and broke her bones.,alenathomasfc,1497243148.0,1849,Politics,i.imgur.com,'',6gq5el
Road block at Karandla (near Nagpur),kash_if,1495713146.0,1835,Non-Political,i.redd.it,'',6d94cy
"2 Indian nationals shot, 1 dead, in Kansas City. Suspect yelled “get out of my country” before shooting men he thought were Middle Eastern",rex_trillerson,1487878630.0,1817,[R]eddiquette,kansascity.com,'',5vsjeb
A slice of Mumbai at night,imnoidiot5,1484782211.0,1817,Non-Political,i.imgur.com,'',5oszmy
Somewhere in Kerala,ironypatrol,1495612934.0,1802,Non-Political,pbs.twimg.com,'',6d0rsm
X-post from r/starterpacks,tiberseptim1,1507265201.0,1748,Non-Political,i.redd.it,'',74lgyz
[NP] I see your Zojila and pull you a little down south to Kashmir Valley.,tintimate,1507879319.0,1734,Non-Political,i.redd.it,'',7637ai
500 rupee and 1000 rupee currency notes won't be legal tender any more,BharatiyaNagarik,1478616620.0,1711,Policy & Economy,twitter.com,'',5btlvp
"Took a photo of my financee's hand holding a diya, on Diwali. [NP]",QuantumEnormity,1508486208.0,1688,Non-Political,i.redd.it,'',77kp73
Leader of world's largest democracy - @arvindtm,bliss_tree,1509334322.0,1633,Politics,i.redd.it,'',79l9g9
Front page(s) of Times of India,Subterfug3,1506020849.0,1621,Non-Political,gfycat.com,'',71lff5
"'Triple Talaq Unconstitutional', Says Supreme Court In Majority Verdict",Moon_Slayer_,1503380989.0,1602,Politics,ndtv.com,'',6v91w2
"Hi I'm Shashi Tharoor. Ask me Anything on India, politics, foreign affairs, history, and more!",shashitharoor2017,1490793930.0,1598,AMA,self.india,'',626l9b
Humble contribution towards Swachh Bharat,Mikeross14,1493699977.0,1595,Entertainment,i.redd.it,'',68r464
I took this picture of Goats near my college ( IIT Mandi ),itsmuks,1505444023.0,1585,Non-Political,imgur.com,'',707638
Abhay Deol tells..,ustart,1492241329.0,1578,Non-Political,pbs.twimg.com,'',65hy70
There's English...& then there's Indian judicial English. From the Indian Supreme Ct's judgment in the Sasikala Case,niufin,1487392650.0,1578,Non-Political,pbs.twimg.com,'',5uqu0k
Mitron.....!,ghatroad,1483180703.0,1559,/r/all,i.imgur.com,'',5l963u
[NP] That explains the overpopulation..,namesnotrequired,1501839321.0,1564,Non-Political,imgur.com,'',6rjdy1
I beg you!!!,goldspots,1507608841.0,1552,Non-Political,i.imgur.com,'',75enp1
Long time no meme.,OnePunchSenpai,1496290049.0,1544,Politics,i.imgur.com,'',6ekcmv
Dramatic rainclouds in Chennai [np],rajeevist,1497086442.0,1513,Non-Political,gfycat.com,'',6gedvr
"View from my plane while i leave my house to purchase bhaaji, gonna miss this place the whole 15 minutes",Shiwanshu1,1502455804.0,1500,Non-Political,imgur.com,'',6t0x9r
"Question paper in IISER, Pune",biswassumit25,1502180336.0,1429,Non-Political,i.imgur.com,'',6sc4nk
"The Milky Way from Tosh, Paravati Valley, Himachal Pradesh",imnoidiot5,1484714051.0,1422,Non-Political,i.imgur.com,'',5onai0
James Bonda,bloody_hello,1498890596.0,1410,Non-Political,pbs.twimg.com,'',6kljzd
GSLV Mk 3 launch as seen from my office in Chennai.,,1496665758.0,1414,Science/Technology,gfycat.com,'',6fduxo
Our ATMs cannot be hacked due to 2 high security protocols... [NP][ZokeTym],voracread,1495005656.0,1381,Politics,i.redd.it,'',6bn7z1
"Rare pic of Einstein, Yukawa (1st Japanese Nobel), Wheeler (who coined ""black hole"") & India's own Homi Bhabha on a walk in the woods.",Renderdog,1506884876.0,1375,Non-Political,i.redd.it,'',73nlaf
This is how the world ends,sir_qoala,1498043378.0,1372,Politics,i.redd.it,'',6il4ov
"Men do not commit suicide, never heard a single such case, says Union Minister Maneka Gandhi",JohnKimble111,1498806111.0,1365,Politics,india.com,'',6ked2u
This pic won the match today,UnescoCertified,1496589338.0,1360,Sports,i.redd.it,'',6f7tw8
The positives,ls_ltr,1479182473.0,1348,Non-Political,imgur.com,'',5d0jbz
"Supreme Court historic verdict: Politicians can't use religion, caste, creed or language for votes",sojana,1483336921.0,1337,Politics,financialexpress.com,'',5ljqjs
"National anthem must be played in theatres before movies, orders Supreme Court",ponniyin_selvan,1480488261.0,1328,/r/all,economictimes.indiatimes.com,'',5fo7bn
Ram Rahim Singh jailed for 10 years.,hrithikkatoch99,1503914340.0,1316,Politics,twitter.com,'',6wifa3
"iPhone X is so expensive in India that you can go to Hong Kong, buy it, come back and save money.",lifehacker25,1505302463.0,1309,Science/Technology,indiatoday.intoday.in,'',6ztyct
Cancel your credit card before you die,GraphicsBhw,1483614834.0,1305,Non-Political,self.india,"""This is so priceless.\n\nA lady died this past January, and HDFC Bank billed her for February and March for their annual service charges on her credit card, and added late fees and interest on the monthly charge.\n\nThe balance had been Rs.0.00 when she died, but now somewhere around Rs.6000.\n\nA family member placed a call to HDFC Bank.Here is the exchange :\n\nFamily Member: 'I am calling to tell you she died back in January.'\n\nHDFC Bank: 'The account was never closed and the late fees and charges still apply.'\n\nFamily Member: 'Maybe, you should turn it over to collections. '\n\nHDFC Bank: 'Since it is two months past due, it already has been.'\n\nFamily Member: So, what will they do when they find out she is dead?'\n\nHDFC Bank: 'Either report her account to frauds division or report her to the credit bureau, maybe both!'\n\nFamily Member: 'Do you think God will be mad at her?'\n\nHDFC Bank: 'Excuse me?'\n\nFamily Member: 'Did you just get what I was telling you - the part about her being dead?'\n\nHDFC Bank: 'Sir, you'll have to speak to my supervisor.'\n\nSupervisor gets on the phone: Family Member: 'I'm calling to tell you, she died back in January with a Rs.0 balance.'\n\nHDFC Bank: 'The account was never closed and late fees and charges still apply.'\n\nFamily Member: 'You mean you want to collect from her estate?'\n\nHDFC Bank: (Stammer) 'Are you her lawyer?'\n\nFamily Member: 'No, I'm her great nephew.' (Lawyer info was given)\n\nHDFC Bank: 'Could you fax us a certificate of death?'\n\nFamily Member: 'Sure.' (Fax number was given )\n\nAfter they got the fax :HDFC Bank: 'Our system just isn't setup for death. I don't know what more I can do to help.'\n\nFamily Member: 'Well, if you figure it out, great! If not, you could just keep billing her. She won't care.'\n\nHDFC Bank: 'Well, the late fees and charges will still apply.'\n\n(What is wrong with these people?!?)\n\nFamily Member: 'Would you like her new billing address?'\n\nHDFC Bank: 'That might help...'\n\nFamily Member: Odessa Memorial Cemetery , Avinashi, Coimbatore\n\nHDFC Bank: 'Sir, that's a cemetery!'\n\nFamily Member: 'And what do you do with dead people on your planet???’""",5m5uav
Haha,sex_with_a_panda,1479434602.0,1308,Politics,i.redd.it,'',5djwry
"Hey r/india, show your love for the cool granny and her friends.",OnePunchSenpai,1493872772.0,1297,Non-Political,i.imgur.com,'',695ipb
"Uber driver asks if I have a 2K note. I ask why. He says, watch. Offers it to the toll guy who gives it back & says it's ok, no toll. Go on.",anon108,1483942659.0,1294,Non-Political,twitter.com,'',5mw41y
A picture to make your heart skip a beat. Two of India's most iconic species - the tiger and the elephant - in the Dudhwa Tiger Reserve.,OnePunchSenpai,1501401892.0,1293,Non-Political,i.imgur.com,'',6qgaog
"Venice of the East, Aleppy.",Tottochan,1499246244.0,1273,Non-Political,i.redd.it,'',6lcxtj
Isro's launch of record 104 satelights - Live updates,anujku,1487131306.0,1278,Science/Technology,m.timesofindia.com,'',5u58pl
9.2-km Bhupen Hazarika bridge as seen from space. It cuts the distance and travel time between Assam and Arunachal Pradesh by 165km and five hours.,,1496122867.0,1272,Non-Political,i.redd.it,'',6e5h25
[NP] Fidget Spinner for Bhai,rzrules,1498023508.0,1269,Non-Political,i.imgur.com,'',6ijujm
"A railway track near Matheran, MH",The-Mitr,1503052942.0,1258,Non-Political,i.imgur.com,'',6uh0k0
When you promised to offer aarti 108 times for passing the AI exam but you don't have time to repay it [NP],s4m_sepi0l,1504241550.0,1255,Non-Political,j.gifs.com,'',6xce7y
as a mumbaikar how i feel about people sharing #spiritofmumbai posts,noelgallagherisgod,1504066232.0,1260,Non-Political,i.redd.it,'',6wwqmh
ISRO finds people walking on the Moon,fakeforconfession,1501584014.0,1255,Non-Political,i.imgur.com,'',6qve4j
Economy,theowaispatel,1506829358.0,1244,Policy/Economy,i.redd.it,'',73jirz
I look at this picture whenever I think life has been unfair to me,waltzchrist20,1503053020.0,1238,Non-Political,i.redd.it,'',6uh0qy
"An old lady working on a Ganesh idol, and a little puppy watching.",OnePunchSenpai,1502778013.0,1238,Non-Political,i.imgur.com,'',6tsfqo
Chester had a great sense of humor too...,itsmuks,1500621358.0,1226,Non-Political,imgur.com,'',6omdg6
"The ""India in reddit"" starterpack",PrematureEjacltr,1504195494.0,1217,Non-Political,i.imgur.com,'',6x7rx4
How about explaining One IPC Section a day here on r/india ?,JamieNoble03,1497174029.0,1216,[R]eddiquette,self.india,"""I will post a text about one IPC section everyday with simple explanation/illustration of its interpretation in **layman's terms**. Anyone else who studied Law can chip in with other posts or comments. \n\nI feel its very useful to raise awareness among laymen regarding our Laws. I can do the same for general legal concepts and jurisprudence. """,6gkl9d
"Rabindranath Tagore in England, 1879 [NP]",ThyssenKurup,1503465643.0,1209,Non-Political,theinkbrain.files.wordpress.com,'',6vgvm8
"86% killed in cow-related violence since 2010 are Muslim, 97% attacks after Modi govt came to power",AAPkeMoohMe,1498622574.0,1208,Politics,m.hindustantimes.com,'',6jy6cg
Rajasthan govt bans private schools from selling text books and uniforms directly. Huge step in breaking monopoly and overcharging [NP],majorwtf,1492491995.0,1198,Non-Political,self.india,"""News in Hindi..\n\n[http://m.rajasthanpatrika.patrika.com/story/jaipur/do-not-force-parents-to-purchase-books-from-schools-edu-min-tells-pvt-schools-2547972.html](http://m.rajasthanpatrika.patrika.com/story/jaipur/do-not-force-parents-to-purchase-books-from-schools-edu-min-tells-pvt-schools-2547972.html)\n\n\nUpdate..\n\nRough translation..\n\nJaipur.\xa0.\n\nFollowing continuous complaints of private schools, the state government has issued guidelines on Monday.\xa0The school's recognition can also be canceled if these guidelines are not followed for private schools.\xa0\n\nIn addition to books, the costumes and other materials set by private schools will also be free to purchase from the open market.\xa0Schools can not name any teaching material.\xa0Can not make pressure to buy materials from a shop.\xa0They can not sell the material in the school premises.\xa0\n\n\nMinister of Education Vasudev Devanani told that the private schools will be able to choose from published textbooks as per the published curriculum according to the NCRT or the Rajasthan State Textbook Board / Secondary Education Board course.\xa0It is mandatory that they should be displayed at the school's notice board and website at least one month prior to the commencement of the teaching session, along with the list of books, author and publisher's name value.\xa0He said, private schools will have to give information on demand.\xa0\n\n3 books to be on the book\xa0\n\nThe Minister of State for Education said that private schools should ensure that the textbooks, costumes and materials recommended for the students are available to the minimum of 3 local vendors.\xa0The fixed costumes can not be changed for five years.\xa0They said that the recognition of the institutions which did not comply with the directions can also be canceled.\n\n""",660vot
How to invite friends over for a drink.,kulchaw,1507354594.0,1198,Non-Political,i.imgur.com,'',74t5jb
[R] The Indian Quora Starter pack,lonewolf_traveller,1498448838.0,1194,[R]eddiquette,i.redd.it,'',6jisfn
"[R] Enough of Himalayas. Here's a picture from the Western ghats, Munnar",Tejas_J,1499576516.0,1189,[R]eddiquette,flickr.com,'',6m5qfo
Harbhajan posted image of air quality in Delhi on his Instagram,yogesh_calm,1494137898.0,1184,Non-Political,i.imgur.com,'',69px99
@CNNnews18: #BREAKING -- Veteran actor Om Puri passes away at the age of 66,AvianSlam,1483674726.0,1187,Non-Political,twitter.com,'',5mbcgj
Here is another one from Mizoram. Aizawl football fans cleaning up the stadium after their team won the I-league.,dkjb14,1493626399.0,1184,Sports,i.redd.it,'',68krt3
Outside global citizen in Mumbai. Where highly affluent and educated entrants took a pledge for being better citizens.[NP],dinonia,1479660231.0,1187,Non-Political,imgur.com,'',5dytla
[NP] Government makes Airbags mandatory for all new cars from October 2017,sushant008,1479007752.0,1184,Policy & Economy,autoportal.com,'',5co5jf
There is only one good crime show,Oblivion_Wonderlust,1495081505.0,1176,Entertainment,i.redd.it,'',6btzuc
[NP] Jugaad Level : 9000,Rickshawalli,1486303909.0,1172,Entertainment,i.redd.it,'',5s7jfi
Photocopying Textbooks Is Fair Use In India: Western Publishers Withdraw Copyright Suit Against Delhi University [NP],ziddich,1489474098.0,1167,Non-Political,techdirt.com,'',5zanfp
The feel when you say Talaq on a hill station,radian_s,1494742924.0,1163,Non-Political,i.redd.it,'',6b2kgh
"Today in 1999, Capt. Vikram Batra, PVC of 13 Jammu & Kashmir Rifles attacked Pak Army position at Point 4875, Kargil & attained martyrdom, Jai Hind",Kejruddin,1499401884.0,1151,[R]eddiquette,i.redd.it,'',6lrd0d
"Believe me, sir! I was stalking the girl only!",karmalife0,1502257937.0,1148,Politics,i.redd.it,'',6sjire
My Buddy chased his dream and beat the odds,naren_93,1497016620.0,1152,Sports,i.redd.it,'',6g8k1e
US Marine opens door for Modi's wife,not_creative1,1498508439.0,1149,Politics,media.giphy.com,'',6jnoz3
"Something my sister just made, quilled Ganesha!",ppatra,1494383532.0,1143,Non-Political,i.redd.it,'',6aa3zn
new logo for r/india - moo snoo,weeping_peacock,1499064582.0,1131,[R]eddiquette,i.imgur.com,'',6kyc70
Kamal Hassan on beef ban....,Lenovojunk,1496250072.0,1130,Politics,i.redd.it,'',6egb1w
"Turnover of a company owned by @AmitShah's son increased 16,000 times over in the year following election of PM Modi",why_reddit,1507446668.0,1125,Politics,twitter.com,'',750d7w
Vijay Mallya looked like Pablo Escobar during his younger days,opi_q,1497502672.0,1123,Non-Political,i.redd.it,'',6hcy22
Amazon Prime video is censoring content and the world needs to take notice,that_70_show_fan,1482897365.0,1121,Entertainment,self.india,"'First of all, this is only case where I found that Amazon Prime is censoring their content. If they are doing the same in other countries please let me know in the comments. \n\nIndia has severe restrictions on what can be showed on TV and what cannot, but rather than the state directly censoring... the TV channels censor their own content. [We have had instances where a channel has been taken off air for showing the wrong map of India.](http://timesofindia.indiatimes.com/india/Al-Jazeera-taken-off-air-for-five-days-for-showing-wrong-India-map/articleshow/47015509.cms) These TV channels take this the extreme, like censoring the word ""beef,"" blurring visuals of beef in cooking shows, blurring visuals of lingerie, etc. \n\nAmazon has implemented this tactic to online streaming content despite India having no laws censoring online videos(aside from child porn). [The government of India has publicly stated that they have no intention of censoring online videos.](https://www.reddit.com/r/india/comments/5i2fi0/ib_ministry_we_are_not_considering_censorship_of/)  \n\nIn response to criticism of censoring their content, Amazon response is:\n\n> ""We will keep Indian cultural sensitivities in mind while offering this content to customers""\n\nThey completely censored an entire segment from Ep 4 of *The Grand Tour* as it showed the carcass of a cow. The runtime of this episode is 30 minutes as opposed to the original 62 minutes. In addition to that they have blurred any instances of nudity. \n\nThey are setting an extremely dangerous precedent by being a willing participant in censoring content. This is the wet dream of the government of India and other countries where the state wants censorship but do not have the resources to implement it on their own. [This comes at a time when Holloywood is bending over backwards to appease the Chinese censor board\\(SAPPRFT\\)](http://www.npr.org/sections/parallels/2015/05/18/407619652/how-chinas-censors-influence-hollywood).     \n\nAs someone who is involved in fighting against censorship, this is a serious blow as I see the rest of the industry following suit. \n\nIndia is still a small market for Amazon, but it needs to know that there are many who oppose any form of censorship by principle. I hope people in the west notice how their companies behave if they see potential to make some extra money. \n\n'",5ko5tu
Programs renamed by Modi government,pakaomat,1497413371.0,1117,Politics,imgur.com,'',6h560p
Ripley's believe it or not!,udi_baaba,1509076816.0,1121,Politics,i.redd.it,'',790wb0
India's first LinkedIn based Matrimony! [NP],purplexxx,1501384948.0,1115,Non-Political,i.imgur.com,'',6qf8lp
Sonu Nigam gets his head shaved after a Fatwa was issued announcing 10 Lakhs for anyone who shaves Nigam's head,shub1991,1492594471.0,1106,Politics,twitter.com,'',6695xo
"Hi from r/theNetherlands! Here's a happy Modi with our happy prime minister Rutte, in The Hague",jaapgrolleman,1498653218.0,1096,Politics,i.redd.it,'',6k09sq
Yogi Taj Visit by Manjul,shhhhhhhhhh,1509015486.0,1103,Politics,imgur.com,'',78us9n
Pick up lines used in different places of India,prakharprasad,1500800708.0,1095,Non-Political,i.imgur.com,'',6p0eu0
Here is a pic from my home. Calicut Kerala,spannerphantom,1506112918.0,1095,Non-Political,i.imgur.com,'',71tu02
"Announcement. This house has been looted thrice already, hence all money, gold, etc are stored in bank. Don't break the lock in futility.",UraniumTatti,1504351393.0,1077,Non-Political,i.imgur.com,'',6xlbyn
Closest India has to Christian Bale,SilentSaboteur,1508731209.0,1076,Non-Political,imgur.com,'',7859jx
Udta Mumbai,ADONBILIVITT,1488014405.0,1072,Politics,imgur.com,'',5w3bh3
India U17 football team just beat their Italian Counterparts 2-0.,ChumbaWambah,1495207844.0,1081,Misleading,imgur.com,'',6c4cmt
MFW I award the Bharat Ratna to myself while I'm the PM,Drone_Acharya2,1495950242.0,1062,Politics,i.redd.it,'',6dsaau
Don't be a hypocrite [NP],shutupaparajita,1491215939.0,1068,Non-Political,i.imgur.com,'',635y2a
A fabric map of India,doc_two_thirty,1497606774.0,1044,Non-Political,i.redd.it,'',6hlkd4
TOI being TOI blames Demonetization instead of Dowry,shashi_sah,1479957025.0,1043,Non-Political,i.redd.it,'',5eljet
"Reddit has been blocked in Kashmir, along with fifteen other social media sites, including Facebook, Twitter, Tumblr, WhatsApp, and Skype.",shadowbannedguy1,1493210832.0,1040,Politics,self.india,"""Here's a copy of the order: https://twitter.com/internetfreedom/status/857213773320523776""",67nvz1
"Sex With Wife Below 18 Is Rape, Says Supreme Court",user123443211234,1507699776.0,1028,Non-Political,ndtv.com,'',75n0k4
Swachh Bharat #MyCleanIndia!,aunty-national,1484545353.0,1032,Non-Political,i.redd.it,'',5o93jt
Cartoon on Demonetization in TOI Today,bhujia,1481694614.0,1030,Demonetization,i.imgur.com,'',5i8xr8
"Shocking! BSF jawan Tei Bahadur who posted video alleging corruption, was asked to retire, now kept under arrest",hipporama,1486024726.0,1021,Non-Political,indialivetoday.com,'',5rlof6
"BJP had offered my father to withdraw rape cases against him for support in Haryana election, Ram Rahim’s daughter claims",modiusoperandi,1503982295.0,1013,Politics,en.southlive.in,'',6wp1or
Petition to Make Xvideos play Indian national anthem before and after a video.,LuciferinBeastMode,1481123900.0,1011,Politics,change.org,'',5h0f64
