[NP] A horrific tale of rape and murder in Gurgaon!,Responsbile_Indian,1496830740.0,407,Non-Political,self.india,"""A woman from Gurgaon on 29th May left her home to go to her parents home after an argument with her husband. \n\nShe was on her way to her parental house at Khandsa village when she was first given a lift in a truck. The truck driver molested her but as she put up strong resistance, he dropped her off on NH 8. \n\nAn auto-rickshaw stopped and offered her a ride. There were three other men in the rickshaw who tried to rape her; when she resisted and baby started crying, they threw her 9 months old baby out on the road. Then the woman WAS RAPED BY THEM FOR 4 HOURS and then dumped on the road. \n\nShe returned to pick her baby up and took her to a Gurgaon hospital. Hospital told her the baby was dead due to injury. She traveled with the dead child on metro to a delhi hospital. When the 2nd hospital confirmed the death, she traveled back via metro to Gurgaon where she picked by her husband.\n\nThe surprising thing is, there was not mention of this whatsoever in media until today when police released the sketches of the murders/rapists.\n\nWe as a nation stand ashamed on the face of this. Don't know when we'll wake up to this menace. If there is a hell anywhere, it has to be Delhi NCR. Keep your family safe guys!\n\n\nhttp://zeenews.india.com/haryana/gurugram-gang-rape-and-murder-case-here-are-the-sketches-of-the-accused-released-by-gurgaon-police-2012813.html""",6fsj7a
Large turnout in Lucknow for UP's first pride parade,gcs8,1492577749.0,407,Non-Political,timesofindia.indiatimes.com,'',6686ep
"North Indians, please educate your people that Hindus in South India, MH and NE India eat beef.",UthaoLungibajaoPungi,1488275330.0,407,Moderated,self.india,"""Every time I tell a North Indian that I eat beef, they react with complete shock and bafflement. They cannot comprehend that it's possible for a Hindu to eat beef. When I tell them that many Marathi Hindus, particularly dalits have been eating beef since ages they think I'm lying. This kind of ignorance in the information age is really annoying. And I'm not even talking about Gujjus ,Rajastastanis and Haryanvis. They will judge you for eating chicken also.\n\nEdit: I dont mean all or majority of Hindus eat beef. Just saying there is considerable population in these states that does eat beef. Should not come as a surprise""",5wn51a
Netflix to sue Hrithik Roshan's Kaabil for plagiarism of its original production Daredevil,pvntr,1481868680.0,413,Netflix denied this,m.firstpost.com,'',5imr9v
This Indian store in the US is pretty serious,iDieEasily,1509505824.0,412,Food,i.redd.it,'',7a115c
Ranveer Singh's dance gif doing the rounds all over the front page,veteran_t,1503044249.0,405,Non-Political,i.imgur.com,'',6ughd7
[SP] Juan Mata in Mumbai,gleek_master,1497860268.0,403,Sports,i.redd.it,'',6i53dj
What's in a Juice's name,bakarmax,1495779934.0,406,Entertainment,i.redd.it,'',6df9ol
"pulse: Re 1 candy Pulse hits Rs 300 cr sales in 2 years, MNCs feel the heat",_be_good_,1488952665.0,405,Non-Political,economictimes.indiatimes.com,'',5y69rw
"Real Life WhatsApp, need your help. [NP]",_2_4_8,1480999056.0,403,Demonetization,self.india,"'I was at the ATM this morning and it was quite empty, no line or anything. The reason was probably that the ATM only had 2000 rupee notes. As I make my withdrawal and come out with the note, I do so while smelling this note. I have a habit of smelling fresh minted money, so I do so. \n\nThis guy in his 40’s, who looked like an office goer that was standing outside the machine to make a withdrawal, notices me. And he asks *“Iss se kiya asli hai malum ho jata heh?""* [By doing this (smelling notes) you know if note is real or fake?] I am like \'what?\' Then he begins to ask me the question more formally or so to say ‘inquiringly’. Now I wanted to explain to him that smelling notes is my thing, but I wondered if he’d think that I am a freak. So I just nodded and said *“Yes, Yes”*. As I am standing in the road for a bus, and the ATM machine was just right next to the road, this same guy comes to me and asks me to smell his 2000 rupee note. I am like \'wtf?\' Now I just take his 2000 rupee note, bring it to my nose, give it a strong whirl and sniff real hard. And I say, *“Yes, this is the smell of real money”*. The guy then takes the note from me, and starts sniffing it like crazy. Like a dog who found a bitch’s scent and tries to acquaint himself with it. Another passerby notices this guy and comes to inquire about it, upon knowing about it, he too rushes into his wallet and takes out fuckin 2k and hands it to me for smelling. I do so, his note is not that fresh but has the same scent. These two morons, as they are sniffing, act really happy with it. As if they know something and others don’t. My bus arrives and as I am getting on it, as a go away gift (like as Batman gives his toy to Kid Joffrey in Batman Begins), I tell them to spread the word so that people don’t get cheated. And these two wave at me like I am the fuckin messiah, both screaming *“Yes, Yes, Hain, Hain”* like a B-grade pornstar. \n\nPeople forward whatsapp without an ounce of thought. It is time we all learn a lesson! Someone in the early 2000’s decided to wear his pants below his waists, and the next thing you know, everyone is wearing them like that even though it made walking harder. Soon, low waist jeans started popping, the ones where when you squat, your ass crack is visible.  \n\nSo here’s what I want you to do, like those viral UNESCO blunders, I want you to smell your 2000 rupee note every time you take it out of the ATM or when someone hands you one that is quite fresh. And when people ask you, you tell them what I told those two morons, or make up your own story, and soon, we’ll have a country sniffing notes. And when this becomes a nationwide phenomenon, two things will happen. \n\n* A) Govt. will chest hump that like that beggar swipe machine, or \n\n\n* B) They’ll launch an initiative to tell people that sniffing notes to know the authenticity of it is a stupid idea. \n\nEither way, a gruesome lesson needs to be taught. '",5gqxc2
Cop Suspended for Sharing Anti-Modi FB Post,magarmacch,1506661565.0,408,Politics,thequint.com,'',735qyp
Ramachandra Guha: ‘‘The greatest favour Rahul Gandhi could do himself and to Indian democracy is to retire’’,unstable_structure,1500668568.0,403,Politics,openthemagazine.com,'',6oqktx
"Today's IPC Section: Section 23 - ""Wrongful Gain"", ""Wrongful Loss"", Gaining Wrongfully, Losing Wrongfully",JamieNoble03,1497180170.0,410,Scheduled,self.india,"'Section 23 of the Indian Penal Code: ""Wrongful Gain"", ""Wrongful Loss"", Gaining Wrongfully, Losing Wrongfully\n\n>""Wrongful gain”.—“Wrongful gain” is gain by unlawful means of property to which the person gaining is not legally entitled.\n\n>“Wrongful loss”.—“Wrongful loss” is the loss by unlawful means of property to which the person losing it is legally entitled.\n\n>Gaining wrongfully, losing wrongfully.—A person is said to gain wrongfully when such person retains wrongfully, as well as when such person acquires wrongfully. A person is said to lose wrong\xadfully when such person is wrongfully kept out of any property, as well as when such person is wrongfully deprived of property.\n\nExamples: A person, X, has rightful legal title to 5 acres of land. Another person, B, sets up a shop on the land without the **consent** of X and prevents X from using the land. Here X has lost wrongfully while B has gained wrongfully.\n\n**Consent** - Nothing is an offence which is done with the consent of the \'victim\', provided the person is capable of giving consent (\n\nOnly an adult person of sane mind, without the influence of intoxication, fear, coercion, undue influence, or **mistake of fact**, can be capable of giving consent (Section 90 of IPC)\n\nFurther example 1: B\'s employer D gets him to consent to hand over his land to D, with the implication that failure to do so will affect his promotion. Here B\'s consent is invalid as it was obtained through undue influence.\n\nFurther example 2: D induced X to sign on a deed selling his land when X was under severe intoxication of alcohol. Here X\'s consent is voidable at his option after he regains his sobriety, since it was obtained when he was not in his senses.\n\nA person can consent only when he is mentally capable of understanding the effect of this consent on his interests.'",6gkwka
Indian national football team break 21-year record to enter FIFA top 100,commie_indian,1493888873.0,408,Sports,sportskeeda.com,'',696f1w
"Blackbuck died of natural causes, Salman claims in Jodhpur court - Times of India",12341213,1485507107.0,402,Politics,timesofindia.indiatimes.com,'',5qg4o9
Consumer awareness campaign...,Darshitreddit,1509586698.0,759,Non-Political,i.redd.it,'',7a8bjz
After all that,BLAZINGSADDLES4118,1504299322.0,402,Politics,i.redd.it,'',6xhejc
"Forget Burhan Wani, Kashmiris in large numbers mourn the death of an Indian soldier draped in the Indian flag.",simplysimplipal,1487991436.0,408,Politics,timesofindia.indiatimes.com,'',5w1xz3
"My graphic designer friend didn't like our new Rs 500 note, so he redesigned it.",fahadgin,1479962231.0,400,Business & Finance,i.redd.it,'',5elwf7
"BJP president Amit Shah’s son, Jay Shah, has seen a dramatic increase in some of his businesses since Narendra Modi became prime minister.",theowaispatel,1507432617.0,404,Politics,thewire.in,'',74zg18
"Sakshi Maharaj Defends Rapist Ram Rahim, Calls Case Bid to Malign Culture",magarmacch,1503678609.0,404,Politics,news18.com,'',6vzl7s
"WikiLeaks on Twitter:""Has the CIA already stolen India's #Aadhaar database?""",ricouer,1503673705.0,410,Science/Technology,twitter.com,'',6vz2f5
The Kochi Metro PR-grab,Keerikkadan91,1497671826.0,404,Politics,i.redd.it,'',6hresq
"TIL: In 1955, Parliamentarians unanimously decided to increase their salary by Re 1, because their existing salary was Rs 420",wordswithmagic,1482929803.0,410,Politics,thestatesman.com,'',5kq3wn
"Pelling, Sikkim",lightghoda,1503154704.0,401,Non-Political,i.redd.it,'',6uphqq
V. K. Krishna Menon: Thug Life,kalpo123,1497684423.0,401,[R]eddiquette,i.imgur.com,'',6hs6h6
The safest mode of transportation [humor],LondonCapital,1497059387.0,407,Politics,i.imgur.com,'',6gcr6z
Bollywood's first oral sex scene,Manhoos,1492503089.0,405,Entertainment,i.redd.it,'',661jjm
Finance ministry official says political parties are exempted under income tax law to deposit old currency notes in their bank accounts,hipporama,1481888997.0,402,Demonetization,twitter.com,'',5inun6
"Indian politician builds mansion with bullet-proof bathroom using taxpayer money | 'It's like the good old days when the feudal lord would have a castle that would have a house as well as his office,' says one critic [x-post /r/worldnews]",Keerikkadan91,1480219181.0,406,Politics,independent.co.uk,'',5f3hgx
Big move by Yogi Adityanath government: UP Madrasas to teach NCERT books; Science and Maths compulsory,Moon_Slayer_,1509353769.0,404,Policy/Economy,financialexpress.com,'',79mihj
"Happy Diwali, folks",countnightlock,1508312778.0,401,Non-Political,i.imgur.com,'',7753wg
"Hi r/India! I'm a 20yr old rapper from Delhi, and this is my new single - Drama.",Vipansh,1504967712.0,399,Non-Political,soundcloud.com,'',6z1zxz
Nice gesture,eyeing,1500968181.0,400,Non-Political,i.redd.it,'',6penp8
I took a picture of houses from my college. (IIN),ScheduledTroll,1505491086.0,405,Non-Political,imgur.com,'',70aqz1
Pranayraj Vangari has written a new Wikipedia article every day for the last year,Abishek_Muthian,1504843298.0,402,Non-Political,blog.wikimedia.org,'',6ysfnn
"Censor Board denies certificate to Malayalam movie because it 'glorifies gay relationships'. ""It is official, Mr. Pahlaj Nihalani (CBFC Chairperson) put the final nail in my coffin,"" the film's director Jayan Cherian posted on FB.",AvianSlam,1488522089.0,403,Non-Political,thenewsminute.com,'',5x8txw
"Bright green meteor explodes over Mettupalayam, in southern Western Ghats.",stochastic_zeitgeist,1485325378.0,403,Non-Political,assets.wired.com,'',5q1ovd
"Netaji meeting Hitler, 1942",indifferentoyou,1505483871.0,399,[R]eddiquette,i.redd.it,'',709zjd
Sh(it),Botatitsbest,1506069091.0,397,Non-Political,i.imgur.com,'',71pooo
"Good sense prevails, Mumbai Police to drop FIR against AIB",SanskariNari,1500437560.0,397,Politics,m.mid-day.com,'',6o6451
Only 31% children get adequate nutrition in Tamil Nadu and that’s the highest in India,,1491574225.0,399,Policy/Economy,thenewsminute.com,'',640lwf
"Navi Mumbai man kisses rescued cobra, gets bitten and dies",garib_rath,1486359094.0,396,Non-Political,mid-day.com,'',5scgay
"TIL every year on average 2,400 students commit suicide due to Failure in Examination.",Elegoogle,1502410606.0,397,Non-Political,en.wikipedia.org,'',6sxj2y
"Irfan Pathan trolled for posting ‘un-Islamic’ photograph with wife. Irfan Pathan’s wife can be seen wearing nail polish in a picture uploaded by the Indian all-rounder on Facebook, which drew flak from some fans.",AfricanMoleSnake,1500377123.0,400,Non-Political,hindustantimes.com,'',6o05ax
First world problem of an NRI,priestishere,1498282155.0,397,Non-Political,imgur.com,'',6j6io8
AMA Request: RAGHURAM G. RAJAN,userfoundname,1478645713.0,402,Policy & Economy,self.india,'His university page has a email address to contact him at',5bwlnw
The PM lied about LED bulbs in his recent speech.,delusional_panda,1507423920.0,397,Politics,self.india,"'The PM claimed in his speech that the cost of LED bulbs has come down because of his government\'s UJALA scheme. Watch here: [https://youtu.be/Im8cC3w7VZw?t=2860](https://youtu.be/Im8cC3w7VZw?t=2860)\n\nThe cost of the LED bulbs has come down drastically since 2010 because of their nature, much like how the cost of computers came down when Moore\'s law was in effect. Look at the US Energy Information Administration\'s report: [https://www.eia.gov/todayinenergy/detail.php?id=15471](https://www.eia.gov/todayinenergy/detail.php?id=15471).\n\nDirect link to the graph from that report: [https://www.eia.gov/todayinenergy/images/2014.03.19/main.png](https://www.eia.gov/todayinenergy/images/2014.03.19/main.png)\n\nI received a joke on whatsapp a few months ago which is very apt here:\n\nModi was walking on a road once. A storm started brewing suddenly and it became very windy. Modi held on to a nearby banyan tree for support till the storm subsided. A couple of days later, Modi gave a speech in Delhi. He claimed, ""Mitron, if I hadn\'t held on to that banyan tree, it would have been uprooted by the storm.""\n\nTLDR: Modi lied and took credit for something his government did not do.\n\nEDIT: [http://www.ujala.gov.in/FAQ](http://www.ujala.gov.in/FAQ)\n\nFor folks that don\'t know what UJALA scheme is, the government supplies LEDs at Rs 70 though the electricity supplier.'",74yr8n
Fidget Spinner Shitpost [NP],Nushisnotonfire,1494870556.0,395,Non-Political,i.imgur.com,'',6bbx4x
"GoAir flight emergency landing: Teens spot plane fire, alert saves 194 lives",wordswithmagic,1486782524.0,400,Non-Political,indianexpress.com,'',5tbu44
[Rant] We need to have well-behaved immigration officials or atleast a way to report their rudeness.,UghWhyDude,1486125622.0,394,Non-Political,self.india,"'I just got off a long-haul flight at about midnight today (CDG -> BOM), and I was appalled to see some of the rudest immigration staff I\'ve ever seen.\n\nSome poor Eastern European lady (who was clearly here on a vacation) had some trouble filling out those shitty customs forms (the ones that are so poorly designed they can never really hold the full information being asked) and the man at the counter (#18) was being an absolute shitlord. ""DO YOU UNDERSTAND ENGLISH?!"" He was bellowing at her, while this woman was just gibbering and struggling for a response, as he yelled at her to get away and find someone to fill out the form. After I finished my immigration check (from an equally rude officer) I went up to her (she was just standing to the side, looking utterly helpless and bewildered and nobody was helping, while the man already started handling the next person in line), helped her out, filled out the form, told one of the jawans standing there to go call one of the two ""ushers"" standing at the head of the line (directing people to the right line) to help her, because she needed assistance. \n\nWhat in the actual fuck, is this how we want to present our country as a tourism hub? I\'ve traveled fairly extensively and outside of some particularly dour-faced but still professional immigration officers in Berlin, I\'ve been faced with nothing but smiles and courtesy, even from the TSA in the US (despite all the horror stories). Some of them are even happy to chat (The memory of a big, mustachio-ed French officer saying ""Aap kaise ho?"" in heavily accented Hindi with a big grin on his face comes to mind). At Dulles, they even have a big board up in the lines leading up to the immigration hall which state that their goal is for their staff to be the first friendly face you see when you make it to the US and mission statements to the effect that happy TSA officers are their mandate. \n\nIn our case, it\'s some *sarkaari chut-nandan* yelling at a lady about her English comprehension. Utterly shameful, and I wish there was a way to report this sort of behaviour. '",5rtp8k
Elon Musk's Hyperloop Picks Chennai-Bengaluru 30 Minutes Travel Route For India Debut,,1484583269.0,395,Science/Technology,indiatimes.com,'',5obnd1
"Thanks to Amma, we now have Designated Eating Streets as well.",,1480925938.0,398,Politics,pbs.twimg.com,'',5gktyw
50 chartered planes to ferry VVIPs to Nagpur for Gadkari’s daughter’s wedding,mathurawai,1480835936.0,396,Politics,m.hindustantimes.com,'',5geddu
Censor board to allow explicit nudity with a new certification A/C.,kitne_aadmi_the3,1478938911.0,402,Edited Title,m.hindustantimes.com,'',5cjkrf
Hello taxpayers! Your money is about to be spent on ad agencies just to prove how shiny flawless Aadhaar is. [NP],in3po,1497352603.0,398,Policy/Economy,self.india,"'- Hello taxpayers! Your money is about to be spent on ad agencies just to prove how shiny flawless Aadhaar is. http://m.economictimes.com/news/politics-and-nation/uidai-set-for-an-image-makeover-to-spend-rs-30-crore-for-its-media-campaign/articleshow/38229744.cms?utm_source=contentofinterest&utm_medium=text&utm_campaign=cppst\n- You know wht else this money could be spent on? FIXING ACTUAL FLAWS! UIDAI be like: fighting critics > debugging\n- Instead of saying, ""OK that is definitely a flaw and we will fix it"", they are saying **these critics have an agenda & support corruption.**\n- **The Govt, UIDAI & Aadhaar backers really REALLY need to stop being so flippant about personal data of citizens being leaked**. It\'s not funny.\n- Want to do an Ad campaign? OK. Then do one on how Aadhaar can be misused by fraudsters to harm citizens!\n- NOTE: Do not, I repeat, DO NOT give your Fingerprint\u200b more than once if you\'re seeking only ONE service. Even if corps tell you it\'s SOP or some shit.\n- It\'s extremely annoying that Govt is going to spend legit taxpayer money to disprove people like me who have been criticising Aadhaar.\n- Get this straight: this is a terrible investment. Criticism is increasing, more people are dissing Aadhaar. \nUIDAI Solution: **MOAR ADS!**\n- BTW, that report is from 2014. Just think about it for a second. Back then it was 30 cr. Now, it\'s also linked to UPI & Govt schemes. \n- **Aadhaar is now being promoted with multiple schemes, so we dont even know how much is going for Aadhaar PR.** http://m.economictimes.com/industry/services/advertising/aadhaar-initiative-and-make-in-india-campaign-promoting-products-or-services-that-dont-deliver-is-a-waste-of-money/articleshow/51564896.cms\n\nEdit:\n\nSource: Meghnad on twitter [@memeghnad](https://twitter.com/memeghnad)'",6gz7gp
Air India behaving like mafia goons: Shiv Sena’s Sanjay Raut,seanspicy2017,1490868816.0,391,Politics,indianexpress.com,'',62d2ww
"<Thought>When Tamilians can get jallikattu restored in the name of culture why we all cannot get weed legalised as it was part of our culture for so long, Lord shiva is revered for the same by so many people.",meetmanav,1485970692.0,400,AskIndia,self.india,"'would like to know your thoughts and i do believe in india people can get things done in the name of religion and culture so why not this, why do we have to suffocate ourselves with foreign brand cigarettes when we have our own weed??? why pay these MNCs billions when baba is promoting Swadeshi.'",5rgvpo
"Rajasthan govt. immunes itself against probe. According to new ordinance, no judge, magistrate, or neta can be probed",pandas_secret,1508499053.0,390,Politics,twitter.com,'',77lhci
Takeshi's Castle to come back on Comedy Central,agentbigman,1507307523.0,397,Non-Political,firstpost.com,'',74orqi
Akshay kumar's Double standards,Naveenadhi,1501324888.0,395,Non-Political,i.imgur.com,'',6qabo5
Even Superman needs Aadhar Card (Credits-fb/tribe of dardnaak jokes),sneppingturtle,1498986251.0,392,Policy,i.imgur.com,'',6ksdme
What I saw today: A daily wage worker paid ₹250 to a mobile shop to link Aadhaar to his phone number. He was told that his number will be deactivated if it's not done.,hebbar,1498973478.0,395,Politics,self.india,"""He is spending his one day earning to link fuckin' Aadhaar to cellphone number. He apparently bought his cellphone last year for 1k.  While I understand that the government can't do much about information asymmetry, this made me really sad. Fuck you, BJP. Also, fuck those who extort poor people.""",6krqbl
Four Policemen Of UP’s Anti-Romeo Squad Caught On Camera Giving Tips On How To Frame Innocents,ajfben,1496895178.0,394,Politics,thelogicalindian.com,'',6fyo6u
Honest Censor Board (Re: Lipstick Under My Burkha) (from AIB),cra21k,1487945482.0,396,Non-Political,i.redd.it,'',5vxmpu
"SC orders ban on sale of firecrackers in Delhi, NCR",gurmanbh,1480065741.0,393,Non-Political,hindustantimes.com,'',5esrke
Kerala Tourism on Twitter: God's Own Country salutes the #TajMahal for inspiring millions to discover India. #incredibleindia,user123443211234,1508408464.0,394,Politics,twitter.com,'',77dihq
