"[NP] Dear Randia, my college, St. Joseph's College - Bangalore, fired a teacher for his opinion on homosexuality, here is the story",awkwardpile,1489167240.0,499,Non-Political,self.india,"'I wanted to share this here, here is the news story: http://www.newindianexpress.com/cities/bengaluru/2017/mar/09/bengalurus-st-josephs-college-sacks-lecturer-allegedly-over-his-homosexuality-1579637.html\n\nThe sheer hypocrisy shown by the college and the teacher\'s own colleagues is surprising.\n\nHere is the teacher\'s story from his Facebook feed:\n\n>So at 9:30 am on March 9 2017, while I am in the middle of a BCom Second Year class, I am asked to come down and meet the Principal of St. Joseph’s College of Arts and Sciences, Fr. Victor Lobo, immediately (so much for any respect for the teacher and classroom and the process of teaching and learning, from the Jesuits). Once there, he makes me wait for 10 minutes outside the office, while my students are waiting in class. Then he calls me in and tells me: “Students are disturbed by your personal opinions. The management has got to know of these opinions. I have been asked to relieve you with immediate effect.” “Really? What opinions?” I ask. “Students are very much disturbed by your opinions (sic). You were hired to teach English Literature. Not to give your personal opinions. Please sign these letters. Leave the college with immediate effect. No need to take any more classes. We will manage,” comes the reply. I remember my contract which says I can be removed “with no reasons assigned.” I get up and leave. I also remember that I need one month\'s notice according to the contract. But never mind. Throughout this meeting, if anyone is disturbed, it is the Principal. He looks ashen-faced, his hands are shaking, his mouth is dry. I am not surprised by this. In classes, my students have talked about what they don’t like about this Principal, even as they love their college. This is my comeuppance for having those discussions.\n\n>This is the Principal who finds a boy and girl sharing headphones immoral and he penalises them for it. This is the Principal who finds a girl hugging a boy on his birthday offensive and penalises her asking what sort of family she comes from where people hug. This is the Principal who pulls students out of the exam, trauamtises them by confiscating their ID cards because they have long hair (boys), are wearing ear studs (boys), have colour in their hair (girls), have a tear in their jeans (boys and girls). This is the Principal who makes students buy concert tickets to raise funds for the college and if they don’t, informs then that they will not get their hall tickets for the exams. This is the Principal who forces students to pay Rs. 500 for the new college building, shaming them by pointing to how expensive their mobile phones are. This is the Principal who does not allow students to cut a cake on their birthdays. This is the Principal who says women, especially, must not to go to pubs. This is the Principal who tells students not to have any relationships out of family. This is the Principal who forces Christian students to go to mass or confiscates IDS and does not give them hall tickets. This is the Principal who says boys and girls should not go for films together. This is the Principal who allows teachers to not allow boys and girls to sit together. This is the Principal who does not like to see boys and girls walk together. This is the Principal who has draconian hostel rules for boys, let alone girls. I could go on but this is enough. This is the Principal whose justification for all this is that Christ University is doing this and we should not give the impression that we are liberal. This is the great Christ University where a student was raped by a priest a few years ago and not only was it hushed up, the student was further traumatised, blamed, forced to leave and she disappeared.\n\n>Yet students take all of this lying down. There is no Pinjra Tod in any of the St. Joseph’s institutions or indeed any institution in Bangalore. These rules apply to most of the Jesuit and Christian institutions all over Bangalore. Teachers take this lying down and have many of these rules applied to them too. They are viewed with suspicion and monitored through a spy network among students (how well Jesuits train their students!) some members of which doubtless reported on me as I have discussions with students in practically every class and in extra-curricular activities on these issues, issues they are very upset about, issues that affect their lives in terrible ways. These students are damaged and policed and surveilled and stunted.\n\n>Yet their parents love this happening to their kids. They agree to an SMS being sent to them every time their kids bunk one class. They silently cough up the money asked for for buildings and concerts held to build buildings. They probably would love to police their children in similar ways at home and many probably do.\n\n>This is the network of family, school, college and institutions in general that stymie the growth of young minds. This is the Taliban with a liberal face.\n\n>When a teacher asks students to think, to think critically, to ask questions, to find out how much labourers doing the furious building on campus are being paid, to think about the implications of this Talibanisation of student lives on the gendered futures of the society we live in, to not be intimidated by threats of being asked to take a Transfer Certificate (TC) and leave if they don’t like things here, they are fired as their opinions are apparently “disturbing” the students. “The students are very much disturbed (sic),” I was told by this Principal who ostensibly has a PhD in English but has never taught an English class in college., who occasionally takes a Theology class and tells 18 years olds that reading fancy Literature in their elite Departments where even the teachers do not like them (entirely made up and putting students against teachers) does not help, that all they need to read is the Bible. That is the true and only Literature.\n\n>I wish the students were really disturbed. **It is the job of the teacher to keep the student disturbed**. If the student is not disturbed, how will anything change in the world? To be destabilised, to be disturbed is the achievement of the teacher. It is not a reason to fire a teacher.\n\n>My only hope is that this case will make students stand up for their rights: the right to a democratic education, the right to a context of democratic practice in education which the Karnataka government and the Constitution of India (which institutions, minority ones or otherwise, have to follow) guarantees not institutions that make up more and more bizarre rules and force them on students.\n\n>As for me, this is not a new story. This is not the first time this has happened to me and it will not be the last. But, unlike the students, I have not, am not and will not take it lying down.\n\nThis dude is one of the only few sane minds we have on the campus. Also, he is a PhD from Cambridge and has been faculty over IIT-H, Ramjas College, St. Stephen\'s, Cambride, St. Xavier etc. With over a decade and half experience. \n\nMost of the faculty, including English, in our college does bakchodi and chutiyapa. Teachers hardly seem passionate about their work. And those who indeed are, this is what they do to them. As a student I can vouch for everything he said about our college and the Principal, Victor Lobo. \n\nWhat\'s astounding is the silence of his own colleagues. The English department which compares Catholic Riots in England with the ""phase"" our country is going right now. The people from the very same department who every time talk about Islamophobia, and how RSS is taking over Bangalore, and how minorities are not safe, and other liberal gibberish, the same English department is silent over something that happened to one of them!\n\nThis is also the same college which hosted a TEDx conference on Homosexuality a few weeks back. Hypocrisy much ? Hosts talks over national and even international issues, but has little tolerance to anything that happens inside the campus.\n\nAnd as he said, nothing would change as in the end the parents here are indeed okay with all this moral policing and everything the colleges and other institutes make their children go through. What\'s sad is the silence of people, the teachers who go on extreme liberal mode while teaching, have gone silent now.'",5ynexd
"When an Indian enters a ""super fun and friendly non-discriminating chat server for all kinds of people"" (90% of the times this holds good)",DemonRyuX,1497429047.0,490,Non-Political,i.redd.it,'',6h67ip
Karan Arjun and powercut..,badbola,1498568040.0,488,Non-Political,imgur.com,'',6jsh16
"Day One, several headphones stolen",AnIndianPatriot,1495672589.0,491,Non-Political,mumbaimirror.indiatimes.com,'',6d69nw
"#BREAKING -- Swords, rods, and bombs seized from outside BJP office in Kannur, Kerala",hipporama,1507622009.0,490,Politics,twitter.com,'',75fkn4
"Love Commandos. Battling for love marriages, and saving inter-caste couples from honour killings",NormalBaba,1502627922.0,487,[R]eddiquette,youtube.com,'',6tevvo
"(X-Post from r/DeepIntoYouTube) Somewhat adorable old indian man making over 2000 videos of him singing indian songs with questionable enthusiasm, almost all with around 100 views and 0 comments.",YuvonGrohiik,1506934228.0,492,Non-Political,youtube.com,'',73rmqd
"India runs on Constitution, not on shariat; triple talaq should be outlawed: Mukhtar Abbas Naqvi",aryaninvader,1503107959.0,488,Politics,indiatoday.intoday.in,'',6umeli
"Ramdev’s Patanjali products fail quality test, RTI inquiry finds",,1496119406.0,490,Business/Finance,hindustantimes.com,'',6e58cs
"20 Years Ago, Indian TV Shows Were So Progressive. What In The World Has Happened To Us Now?",clanlord,1482120248.0,487,Entertainment,scoopwhoop.com,'',5j4d6w
"Happy Diwali, r/India :)",ingenioutor,1508339491.0,491,Non-Political,i.imgur.com,'',7776j4
Using the fidget spinner before it was cool,frickfrackcute,1501560003.0,495,Non-Political,i.redd.it,'',6qtsqm
It happens only in India.!,Tottochan,1499196779.0,487,Politics,i.redd.it,'',6l97af
"Religion should be confined to museums, says Javed Akhtar",GL4389,1483945072.0,491,Politics,indianexpress.com,'',5mw9p6
Supreme Court rejects petition asking to make national anthem mandatory in courts,FrankSlenderwood,1480659325.0,485,Politics,indialivetoday.com,'',5g1sgk
It's irritating to see people who gave up their citizenship bitch about India [NP],,1488684460.0,486,Non-Political,self.india,"'Am ""onsite"". Client is a guy who gave up Indian citizenship and became A US citizen. Nothing wrong with that, except he kept on telling me and other goras "" you know what the problem with India is?"" With the typical fake accent that Indians get when they change citizenship. Along with the implied superiority ( ""I came out of that shithole but I know everything"" types ) \n\nYou can say whatever you want about India but don\'t expect me to give a fuck about what you\'re saying if you chose to give up your Indian citizenship. \n\nThis has created an uncomfortable work environment but I\'m happy I got it off my chest. '",5xkwd6
"You Have No Sense Of Responsibility, Angry Court Says To Sri Sri Ravi Shankar",modiusoperandi,1492684581.0,484,Politics,ndtv.com,'',66gvb2
"Manmohan Singh had Ignored Pressure, Backed CBI in Dera Chief Case",iu123,1504082490.0,483,Politics,thequint.com,'',6wxtvl
[P] Why can't Yogi Adityanath...,egress63,1502631303.0,487,Politics,self.india,"'use cows for oxygen in the Gorakhpur hospital? Vasudev Devnani, the education minister of Rajasthan made a statement recently that [cow is the only animal that breathes out oxygen.](http://www.hindustantimes.com/india-news/cow-only-animal-to-inhale-and-exhale-oxygen-rajasthan-minister/story-a8nPi8XDxpvO8YKwibN5RJ.html) Problem soved!'",6tf4p2
Fucking Anti-nashunal,SanskariNari,1502453627.0,484,[R]eddiquette,i.redd.it,'',6t0qcs
I'm going to tell you something which will bring earthquake(Bhuchal),,1482473106.0,486,Unverified,self.india,'Gangadhar hi Shaktimaan hai',5jvlkm
<Serious> Pregnant and heading towards termination alone.,scared_n_nervous,1481263574.0,482,AskIndia,self.india,"'My UPT strip displayed 2 lines yesterday morning I am freaking out since then. I have consulted 2 gynacs already yesterday, one straight away denied by saying abortion is not supported by the hospital she is practicing in and didn\'t gave any other details of the process or options i am left with. Once i asked for a refund of consultation fees she was not comfortable doing that either. Even if it was a christian missionary hospital what they did was unethical. Keeping this aside, the second gynac I went to asked few personal details, suggested me a sonography and scheduled another appointment with the father of the kid or guardian. Here i don\'t understand why do I need anyone along for this decision? I excused her saying my mate is not in town and she kept on insisting on some guardian to be around. Honestly, I don\'t want to involve him in this. Or anyone else for that matter. ( Please don\'t ask me why, how, when etc ""W"" ""H"" questions. ) The problem is I am already 6 weeks down. I don\'t have much time left for non surgical procedure. \n\nAny suggestions on this will be really helpful. \n\n*Trolls please excuse, not this day, not this thread please* \n\n\n\n**Edit 1:** Thank you all for your help. I have just returned from getting my sonograhy done. The radiologist says its not ectopic sac though she has found some cyst on my left ovary and wants to me consult gynac tomorrow. Can any one around please tell me if there will be any complications in terminating the pregnancy due to this cyst? Or any other complications for that matter. \n\n'",5hc864
Remember that fancy dress competition thread? I have another winner for you.,Expedite,1503926183.0,487,Non-Political,i.redd.it,'',6wjbc2
"Country's Biggest Solar Park In Rajasthan, At The Heart Of India's Clean Energy Push. Once the Bhadla Solar Park in Rajasthan is fully operational, it can generate power that could meet the state's total power demand.",Chingum,1496723615.0,482,Policy/Economy,ndtv.com,'',6fjllk
Full blown racism at my village new temple inauguration,nexusFTW,1494003771.0,480,Politics,self.india,"""Let's start by mentioning each issue. \n\nNo one from SC & ST cast is allowed to donate any money temple box. \n\nIf any one from SC & ST want to donate money in trust, trust will not provide them donate slip and their name will not mention any where. \n\nFor total 3 days inauguration lunch & dinner will be served separately and their eating box will be away from normal eating place which will be used by other cast. \n\nThey are not allowed to participate in any volunteer work at all excluding cleaning out kitchen and washing utensils. \n\nThey are not allowed to enter temple for first 3 days. \n\nBTW temple is for our Famous Hanuman ji. \n\nWhat outrageous is they have collected almost 5 crore in donation and total expenditures for 3 day is around 1.3 crore max.. \n\n""",69fxp6
"Hotstar censored Samsung products catching fire skit from John Oliver's ""The Last Week Tonight"" episode aired in India this week",asteriskspace,1489664788.0,486,Science/Technology,mashable.com,'',5zq38s
The massive corruption you never heard of - multi-billionaires Adani and Ambani vs an India without electricity,indianspoiler,1508676780.0,484,Policy/Economy,self.india,"""So Adani , Ambani and Tatas started setting up power plants in Gujarat and Maharashtra with Business Plan of importing cheaper yet quality coals from Indonesia. The coal price was then used to fix power plant tariffs.\n\nIndonesian Govt then realizes that it has such a bad deal and passes a law to put its coal prices to international market price - basically now the coal is costlier\n\nSuddenly the rich indian business men go to Central Electricity Regulatory commission to tell that - hey the coal prices are now up and the power plant is unsustainable - no electricyt for u poor people in india....so CERC makes a committee to investigate and finally approves the end tariff to go high\n\nOn the other end these business bought stakes in indonesian mines, made JVs and some agreements blah blah. But the point is they were basically their own subsidiaries. Now when u sell an inflated electricity adn pay inflated coal price - the profit is not going to indonesia - it is actually going to you\n\nAdani did not stop there... in the invoice submitted they also submitted increased Power plant equipment prices. Now this is weird as all plants should be importing similar equipment right? - But Adani bhai made a front in Dubai to help himself. But why to over invoice just the power equipment- they also massively over invoiced coal itself. All coals were also invoiced up both interms of quality and quantity. When people will pay through increased tariff - then lets make moolah.\n\nBy the way - how does invoicing gets done so easily? - whel because Adani owns the fucking port itself\n\nCERC committe approved all of this - even though KPMG was consulting them and in its report it showed that Adani basically owned the mine, the equipment supplying co and the power plant itself.\n\nthat committe had 2 prominent people - Mr Deepak Parekh who was HDFC chairman and head of SBI Capital Markets - Ms Arundhati Bhattacharya ---yes the same who went on to become SBI's chairman\n\nMore links:\nPIL about this which I am sure will go nowhere :\nhttp://indianexpress.com/article/business/companies/over-invoicing-by-power-companies-pil-in-delhi-hc-seeks-sit-probe-against-firms-4842567/\n\nDRI investigations:\n http://www.epw.in/journal/2016/14/web-exclusives/how-over-invoicing-imported-coal-has-increased-power-tariffs.html\n\nThere are links in the articles itself - so help urself\n\nFinally link on Australian investigations about Adani's fronts in Cayman Islands and British Virgin Islands https://www.theguardian.com/world/2017/aug/16/adani-mining-giant-faces-financial-claims-as-it-bids-for-australian-coal-loan\n\nOriginal Article:\n\nhttp://www.epw.in/journal/2016/20/web-exclusives/power-tariff-scam-gets-bigger-rs-50000-crore.html\nHate Capitalism anyone?\n""",7800uc
SC suspends ban on trade in cattle for slaughter,wanderingmind,1499756643.0,481,Politics,economictimes.indiatimes.com,'',6mkluq
What Is Wrong With Bollywood Dance Songs? [NSFW Language],GeneralError,1483882562.0,483,Entertainment,youtu.be,'',5mqv38
[NP] madam_irl,PATAK_KE_MARUNGA,1504531212.0,485,Non-Political,i.redd.it,'',6y09rd
Digital India? India Post does not accept Cards,lgears,1481884695.0,481,Demonetization,self.india,"'Seriously the politicians and PM who speak about digital India, cashless economy please respectfully get lost.\n\nI could not send a parcel via India Post today because India Post does not accept cards. Also no cash in any ATM not even Rs.2000/- notes. I literally went hunting for cash for almost 4 hours, but no cash available anywhere.\n\nIf ""Government of India, Department of Post"" does not accept cards, PM must stop spewing garbage out of his mouth about going ""digital"".\n\nSorry I have never been so angry until today.. '",5inm18
well said Kangana on Karan show,1320MillionPeople,1487665781.0,479,Entertainment,pbs.twimg.com,'',5vag2x
No laws in India to protect customers if they lose money during digital transactions,hipporama,1480679828.0,479,Policy & Economy,wap.business-standard.com,'',5g2vyi
Where is the outrage over the killing of the e-rickshaw driver who opposed public urination?,,1496451103.0,482,[R]eddiquette,hindustantimes.com,'',6eydt4
"Sri Sri event destroyed Yamuna floodplains, restoration will cost Rs 13 cr, take 10 years: NGT panel",I_call_it,1491998189.0,478,Politics,hindustantimes.com,'',64xod9
"I took this photo of a leopard, deer and lion in front of my college. (REDD IIT, India)",ppatra,1505457090.0,477,Non-Political,i.redd.it,'',7084v3
"Man Saves Tyres from Puncture Mafia, Collects 70kg Nails From Road",garib_rath,1482849584.0,476,Non-Political,thequint.com,'',5kk04f
RBI Data Confirms Note Ban was a Total Failure,Indra_Sen,1504101132.0,476,Demonetization,newsclick.in,'',6wz9rs
"Amit Shah on Gorakhpaur tragedy: ‘In a big country, not the first such incident’",KoffeeByte,1502710240.0,477,Politics [website updated title],indianexpress.com,'',6tlsr2
"[Ent] Now Kangana Ranaut writes an open letter: 'If Saif Ali Khan's point is true, I'd be a farmer'",europeanshepherd,1500705311.0,475,Non-Political,firstpost.com,'',6otlsj
How can you make Aadhaar mandatory when we said it’s optional: Supreme Court to Centre,hipporama,1492755621.0,474,Policy/Economy,indianexpress.com,'',66ni6w
"Karnataka rejoice! No VAT on wine and beer, movie tickets capped at Rs 200",pure_haze,1489576060.0,476,Politics,business-standard.com,'',5zipmw
Which one of you has started this?,akspidey,1482735655.0,477,Entertainment,i.imgur.com,'',5kcl7l
"[OC] Various photos around Kolkata, 1945-1947",descriptivetext,1480957017.0,476,Non-Political,imgur.com,'',5gmyum
SIM Cards Not Linked To Aadhaar Will Be Deactivated After February 2018,user123443211234,1505017608.0,474,Politics,m.ndtv.com,'',6z6dx0
[NP]IMD scientist lodges 'cheating' case against cook for hiding caste,diggydiggydigdig,1504840985.0,469,Non-Political,dnaindia.com,'',6ys92u
"EC seeks ban on anonymous contributions above Rs 2,000 to political parties - Times of India",Lord-Lannister,1482057041.0,479,Politics,timesofindia.indiatimes.com,'',5izoqi
BJP Landslide Victory in UP. Does this mean Modi for PM 2019?,simplysimplipal,1489206292.0,470,Politics,self.india,"'After demonetisation, many felt that Narendra Modi would have a tough time in Uttar Pradesh. \n\nSource: NDTV\n\nUttar Pradesh (403 Seats-BJP Win)\n\nBJP+:325\nSP/Cong:56\nBSP: 19\n\nPunjab (117 Seats-Congress Win)\n\nCongress:77\nAAP:22\nSAD/BJP:18\n\nUttarakhand(70 Seats- BJP Win)\n\nBJP:57\nCongress:11\nOthers:2\n\nGoa (40 Seats- Hung Assembly)\n\nCongress:18\nBJP:14\nOthers:8\n\nManipur(60 Seats- Hung Assembly)\n\nCongress:27\nBJP:22\nOthers:1\n\nThe Trends:\n\n1.BJP has landslide victory in Uttar Pradesh and Uttarakhand\n2.AAP failed expectations and lost to Congress in Punjab\n3.Irom Sharmila electoral debut ended in massive failure.\n4.Mayawati is a sore loser.\n\n\n\n\n\n'",5yqwp7
Dangerous nonsense: Once we put the Indian military above criticism we become Pakistan,laudalasan,1497720869.0,473,Politics,blogs.timesofindia.indiatimes.com,'',6huog4
PSA: Get Kicked Out of a WhatsApp Group. [NP],_2_4_8,1479539470.0,471,Non-Political,self.india,"'*What you read on WhatsApp is the truth, everything else is just a lie.* \n\n-UNESCO\n\nOne of the key features missing in WhatsApp is the ability to stop people from adding you in groups. Sure, you can exit one, but there’s no way to stop them from adding you again, unless you block them, or ask them to stop doing so. The latter, is highly unlikely.\n\nDay before yesterday, I was added into a WhatsApp group of 34 people, by noon, it had enlarged itself to 44, I left, but the 5 admins kept putting me in it. I barely knew half a dozen people in that group. I asked them politely to stop adding me, but was met with replies like *“Kya yarr?” “Kuch nehi hoga…blah blahh….”*\n\nSeeing no option, I muted that group late at night and went to sleep, stupid me, muted it for only 8 hours. In the morning when I woke up, and turned on data, my fuckin WhatsApp blew up with over a 1000 messages; my phone nearly hanged.\n\nI left, was added again, I called the scumbag out, but it fell on deaf ears. This is getting a little cumbersome, you alll know what is going on, so without further ado, I give you the recipe to rekt a whatsapp group and get kicked out.\n\nI muted that group yesterday, and slept on it with an alarm set for 5 AM this morning. Sure enough, 700 unread messages, last text was at 2:40 AM, and some forwards I don’t care for. \n\nI personally looked up each and everyone of those people that were in that group, not one was online. NICE!\n\nI went into **SETTINGS>ABOUT PHONE>LEGAL INFORMATION>OPEN SOURCES LEGAL**\n\nThe /Kernel file alone was about the size of the Bible. I copied all of it and pasted it in the WhatsApp group. All and all, I kept sending that same shit for around 40 mins. \n\nI went to sleep and woke up at 8 AM, turned on WhatsApp and one guy is calling me a chut. By 9:30, one guy is complaining that his phone froze and he had to take out the battery, another is calling me out personally, I blocked him. The scumbags have now started revolting against me, by 11 AM, one of the admins who got the kick of his life, kicked me out. \n\nSo there you go, 100% tried, tested, and certified by UNESCO method of getting kicked out of WhatsApp groups.\n'",5drefr
UAE Billionaire To Invest Rs 1000 Cr To Make 'Mahabharata' & The Crew Includes Oscar Winners!,pure_haze,1492434812.0,472,Entertainment,indiatimes.com,'',65vgoy
Atleast they could have saved money on photographer,ammy_023,1483396979.0,471,Non-Political,imgur.com,'',5lo5dn
IndiaTodayFLASH on Twitter: Rajashtan High court recommends life imprisonment for cow slaughter . Also make Cow national animal.,yonhi,1496217232.0,467,Politics,twitter.com,'',6edi95
Madhya Pradesh: Man stabbed for supporting Sonu Nigam’s azaan tweet on Facebook [NP],,1492690853.0,470,Non-Political,hindustantimes.com,'',66hblm
"Beautiful India (Day 5) : Leh-town, Ladakh.",Abzone7n,1479227316.0,469,Scheduled,i.redd.it,'',5d3eqa
I can't get rid of this Addiction!,ksot9635,1509277210.0,466,Politics,i.redd.it,'',79g1qt
"In Shocking Videos Of Cow Vigilante Attack, Jammu Family Begs For Mercy",rahulthewall,1493032584.0,467,Politics,ndtv.com,'',678emb
