"RTI Response from ""PMO India"" on who will compensate for aadhaar bio-metrics theft, misuse, authentication failure",aadhaarfail,1505187773.0,633,Politics,self.india,"'Dear Redditors,\n\nI have emailed help@uidai.gov.in, banks, supreme court, media, etc. repeatedly asking them when my fingerprint gets stolen, printed in transparency, used to clean bank a/c via aadhaar pay, which agency (UIDAI, NPCI, Government of India, Bank) is liable to pay  me compensation. I did not get any response from anyone.\n\nSo I filed RTI to ""PMO India"" after UIDAI refused to provide any information via RTI. \n\nCheck the response from the ""Anti Corruption"" messiah. \n\n\nhttps://imgur.com/a/3gX8o Jai Hind.\n\nEDIT 0:\nRTI Questions: \n\nIf my aadhaar number or bio-metrics(2d/3d printed fingerprint) gets misused and causes me financial loss, which organization UIDAI, Bank, NPCI, PMO , ""Finance Ministry"", etc. will compensate me?\n\nIf my aadhaar authentication fails in an website and website does not bother to resolve the authentication issue within reasonable time frame and it causes me immense mental harassment, financial loss, which organization will compensate me?\n\nIf no one is responsible for compensating me for aadhaar misuse, bio-metrics theft, authentication failure, what moral authority have you got to shove aadhaar down billion Indian\'s throat. \n\nEDIT 1: Summary of response is ""This is not a question which needs an answer""!\n\nI have already filed first appeal, complained via\nhttp://dsscic.nic.in/online-complaint-application/onlinecomplaintapplication\nnothing happened, how can a person (working for corrupt corporate) remove corruption, he can at most torture common people and opposition in the name of ""removing corruption"".\n\nEDIT 2: WTF link aadhaar to bank account knowing very well, when bank account gets looted using ""stolen fingerprint"" via aadhaar pay - UIDAI will not even file an FIR on behalf of YOU, JioCare leaked aadhaar e-KYC details for 120 million Indians, nothing happened to them, not even an FIR was filed!\n\nEDIT 3: Convert your bank balance into bitcoin and other crypto-currencies, linking aadhaar with bank will collapse Indian economy, bitcoin is widely accepted, if million Indians shift to bitcoin and start promoting it, we should be able to live with bitcoin for a long time, till aadhaar is thrown out in dustbin. Jai Hind. If you think I am bitcoin salesman, suggest a better alternative to get rid of aadhaar babajis arun jaitley, narendra modi, ravi shankar prasad ka maafi\n\n\nEDIT 4: To all RTI activists in this post,  I have filed many RTIs on other subjects, got proper response, in some cases they even accepted that to cater to my question, law needs to be changed and they have forwarded it to appropriate authority for consideration. \n\nEDIT 5: Your bank is responsible for credit card, debit card theft, call them within 24 hours of the theft, they will block card, issue replacement card with different PIN. HTF will you block aadhaar card and fingerprint? \nStolen fingerprint can be used to unlock your bio-metrics at an aadhaar enrollment center, stolen fingerprint can also be used to change your mobile number in aadhaar database, Jai Hind.\n\n\nEDIT 6: When your bank account gets looted via aadhaar pay, you will call 1947, wait for 3 hours to get connected, the call center folks will simply ask you to visit aadhaar enrollment center, waiting list being 3 months, you will bribe 1000 INR and get an appointment with aadhaar enrollment center to resolve aadhaar misuse, they will ask you to email help@uidai.gov.in, you will send 10 emails in 10 days and then get a generic mail, asking you to specify all your details including preferred condom brand, etc, you will respond with all details, you will follow up for 3 more days, then you will get a generic FINAL response, ""Please lock your bio-metrics in UIDAI website, Jai Hind!"", after that even if you send 100 emails you will NOT get any response. You lock your bio-metrics, the criminal go to an aadhaar enrollment center and unlock your bio-metrics using stolen fingerprint and keep on looting your hard earned money.\n\nhttps://www.reddit.com/r/india/comments/6zr2l4/locking_your_biometrics_does_not_protect_you_from/\n\n\nhttps://www.amazon.in/Refuted-Aadhaar-Biometric-12-digit-Revolution/dp/154867270X/ref=sr_1_5?s=books&ie=UTF8&qid=1505383796&sr=1-5&keywords=aadhaar'",6zkjcb
"Triple talaq unconstitutional, no personal law above Constitution: Allahabad High Court [NP]",,1481179886.0,640,Politics,indiatoday.intoday.in,'',5h5j40
"Lord Hanuman statute in Vizianagaram, Andhra Pradesh. It was overcast and I waited a while for people to clear. Alas! Someone snuck in.",inquilab_zindabad,1498576580.0,631,Non-Political,i.imgur.com,'',6jtc8q
Dirty old men: Aged Arab sheikhs caught while trying to 'buy' child brides in Hyderabad,Moon_Slayer_,1505908100.0,634,Non-Political,thenewsminute.com,'',71aigi
Zomato customer care with a personal touch,ramanujam,1481606238.0,636,Non-Political,imgur.com,'',5i1st3
It's us who are getting fucked after Demonetisation.,ppatra,1501556828.0,630,Demonetization,self.india,"""I mean look at everywhere, everything is now a clusterfuck. \n\nBanks charging for UPI, debit transaction. Shops not taking 2k notes. Refusing to accept ₹500 even  for a tiniest ink, pencil mark. Sbi already lowered their interest on savings account which other banks are going to follow soon. Everyday there's a whatsapp forward and stupid people stops accepting ₹1, ₹10 coins. \n\nand Digital India? if banks start charging for Upi which was meant to solve wallet problems by making bank to bank transfers simple then who's going to use it?  and that upi channel is not stable, most of the time it refuses to send for no reason. and here's where UPI stands: no one knows it exists, and who knows simply refuses to sign up because of bank charges.\n\nI'm a honest taxpayer, with no black money. Wheather Demonetisation was a boon or curse to us what I know is we are the one who's paying what damage was done with our own hard earned money. \n\nWhat was the point of Demonetisation then? not a clue how much black money was found after Demonetisation, they are still chilling and here we are dealing with this clusterfuck.\n\nIt's exhausting.\n\nBut still Bharat Mata Ki Jai. 😥\n\n\n""",6qtjc8
"Paul Manafort, a former presidential advisor and Donald Trump's campaign manager, was paid by the Pakistani Inter-Service Intelligence Agency (between 1990 and 1994) to spread lies and divert attention from terrorism in Kashmir.",LanguageLimits,1502422395.0,633,Politics,en.wikipedia.org,'',6sylgu
Indian mother owned his son on Facebook,SanskariNari,1508256735.0,628,Non-Political,i.redd.it,'',76zkzj
Hyderabad INOX fined Rs. 5000 for charging Rs 50 for a water bottle,Gyanam,1492943035.0,623,Business/Finance,thenewsminute.com,'',671knk
These people. They are everywhere!!,pratyashi,1479135095.0,628,Politics,imgur.com,'',5cwaxr
"Ranganathaswamy Temple, Srirangam",s18m,1503058683.0,625,Non-Political,i.imgur.com,'',6uhfj8
Today is the one-year anniversary of TRAI's prohibition of discriminatory data pricing services. Here's how it has made India one of the best places for Net Neutrality in the world.,shadowbannedguy1,1486530320.0,625,Policy/Economy,self.india,"'Ever since TRAI prohibited discriminating on data tariffs, several things happened:\n\n- Making separate ""WhatsApp"" packs or ""Facebook"" packs became illegal.  \n- Having some services free on an ISP\'s network while others were charged regular tariffs, became illegal. Eg. Wynk, Airtel\'s music service.  \n- No Internet provider could any longer compete on which popular service they could ""garden-wall"" for a lower price than the rest of the Internet -- it was now either all of the Internet, or none of it at all.   \n- No app/website/service could now tie up with an ISP in order to get an edge over other content providers who couldn\'t afford such an arrangement.  \n\nThe TRAI prohibition forced Internet providers to make a \'level playing field\' a reality. **No country in the world, be it the US or an EU member nation, has such a comprehensive bright line regulation to ban zero-rating.**\n\nIn places like the US, where Net Neutrality laws only focus on speed, zero-rating has become very common, with carriers like T-Mobile having plans where some services are free on mobile data, while the rest of the Internet is paid.\n\nWith the appeal that zero-rating has, but with the [disastrous implications](https://www.techdirt.com/blog/netneutrality/articles/20160208/06220233547/india-bans-zero-rating-as-us-pays-price-embracing-it.shtml) it would have resulted in, we need to be thankful that our telecom regulator had the foresight to set a bright-line regulation to ban discriminatory data pricing.\n\n# What remains to be done\n\nA crucial aspect of Net Neutrality is **traffic management**. Internet providers need to manage traffic to manage the health and stable functioning of their network. However, many ISPs use ""traffic management"" as an excuse to systematically under-invest in network infrastructure and slow down services that compete with those they have an interest in. Some ISPs also put a bouquet of services on a ""fast lane"", which have faster speeds not because of better peering, but because the rest of the Internet is *necessarily* slowed down compared to them.\n\nTRAI\'s [current Net Neutrality consultation paper](http://trai.gov.in/consultation-paper-net-neutrality-0) seeks to address this issue, and define *what* exactly reasonable traffic management practices are. Please give this consultation paper a read -- I believe this final consultation process can make India the absolute best country in the world in terms of Net Neutrality regulation, bar website blocking.\n\n'",5sqrui
Demonetization : it's over. Government won.,bad_joke_maker,1482141829.0,620,Demonetization,self.india,"'I was hoping that a bad step and worse implementation would lead to at least some damage to the government electorally. But, probably somewhere in my heart I still thought the government to be the good guys though egoistic. \n\nTwo recent steps have shattered my faith in the goodness of the government as well as confirmed to my rational mind that they are going to sweep every election. \n\nFirst is the limit of only 5000 INR till the end of the year for deposit. This way they will manipulate the total amount of money back into the system and force a windfall. That number will be shown as the success of the exercise. Then it will be used for sops in the budget. \n\n\nSecond step is the partiality towards places where elections are going to happen for remonetization. This is so vicious. Basically, if you create artificial scarcity and then be partial to some people, they will not remember that you are the source of the scarcity. The people will just be grateful to you. This ensures victory in UP. \n\nI feel betrayed as a citizen, but I can see it rationally. It is over. The government won. \n\nJai Hind. Jai Modi. Bharat Mata ki jai. I am defeated and will now agree with everything the government says.'",5j5nbp
Rajkummar Rao’s political satire ‘Newton’ is India’s entry for the Oscars,boredmonk,1506070850.0,623,Non-Political,hindustantimes.com,'',71psbs
"BJP sees cow in people’s fridges, plates but not on streets eating poly bags: Sisodia",sir_qoala,1498807047.0,614,Politics,m.hindustantimes.com,'',6kefaq
Would you guys like a series on Indian constitution? (Introduction to Indian constitution in layman's terms.) [R],nomadsunil,1498104097.0,620,[R]eddiquette,self.india,"'I see a lot of queries here regarding constitution and governance on daily basis. These post get quiet a few upvotes but participation on these post is very low.\nI also see a lot of you misinterpreting FoS&amp;E, center-state relations etc.\n\nSo would you like a crash course on Indian constitution and governance?\n\nEdit: You guys have spoken! I will explain Part/Article of the constitution (depending on the length) on every Saturday morning (Sorry can not do it daily). I will try to explain every aspect of the Part/Article and FAQs related to that Part/Article. I will also try to answer your queries to best of my knowledge.\n\nEdit 2: This blew up beyond my imagination. I will try to include the suggestions in the comments. '",6ir3zi
Peak Bangalore,ironypatrol,1494478163.0,621,Non-Political,pbs.twimg.com,'',6ai1qk
"[NP] [Joke] When Virat Kohli was a kid, his neighbor asked him...",ribiy,1489051242.0,615,Non-Political,self.india,"'*""Beta which Which channel do you watch?""*\n\nKohli : *""CNBC""*\n\nNeighbour: *""Aren’t you too young to watch business and shares related channels?""*\n\nKohli’s mother: *""He is saying Cartoon Network.""*'",5ye4bi
"Anti-science culture is growing, need to engage and educate, say Nobel Laureates",shr612,1484279917.0,619,Science/Technology,indianexpress.com,'',5noco7
"Man posts Kamal Ka Phool Hamari Bhool, Facebook blocks him for 30 days and deletes post",anticholinergic,1506572762.0,618,Politics,indiatoday.intoday.in,'',72xtum
[NP] Answered : Why scientists don't work for India?,ameyano_acid,1500433294.0,613,[R]eddiquette,self.india,"'I feel Reddit is a safe place to share this.\n\nI\'m pursuing a Bachelor of Science in Biochemistry and Biotechnology and I\'m currently in my second year. I always talk about going abroad to study further and a very stupid statement I hear every time is - ""You should stay back and work for your country.""\n\nMy answer usually is -\n\n1. Fuck you. (I don\'t say this aloud.)\n\n2. How about you stop being cunts to scientists and stop promoting fuckall cow logic to other people? There is so much pseudo science in this country, no scientist wants to stay back that\'s for sure. (No offense to ISRO people because luckily we don\'t doubt the existence of space at least.)\n\n3. India, as a country gives AWAY billions of Rupees to temples and religious places. This is a very major problem. Temples should fund scientific research as they get so much money whereas students like us have to beg for sponsorships (which nobody offers) to fund our research.\n\n4. The government does not promote science at  school level whatsoever and teaches students Ramayana with flying monkeys lifting mountains for just one bloody plant. (Cuz fuck ecology eh?)\n\n5. India lacks R&D attitude and we probably are the least innovative country in terms of life sciences and ground breaking research. Sabko engineer hi banna hai? (No offense but I\'ve seen dumb kids trying to become engineers then drop out and then do some stupid course. Every parent wants their child to be an engineer for some apparent engineer. Both my elder sisters are and my parents wanted me to become one too. I resisted. I get dissed everyday.)\n\n6. The last Nobel prize an Indian won was in 2009. And before that in 1927. Superpower by 2020 my ass.\n\n7. Illiteracy is a problem in this country and students like us would love to see India making it big but politicians are amazing and say cows inhale oxygen and exhale oxygen. Cows excrete plutonium (ikr!) and what not.\n\n8. The laboratories offered to undergraduate students are pathetic. Any high school in the West has a better laboratory than ours. We have to manually do all the tedious work which could be easily automated with the right equipment but NOOOOOOOOO. Ambulances for cows please.\n\n9. When was the last time you donated money to Science? I\'m sure you can recall donating a ton to temples.\n\n10. Godmen are more popular than scientists. Everyone knows Asaram Bapu and Radhe Maa. Ever heard of Har Gobind Khorana? (Many of you must know about him but you have to agree scientists and engineers are less popular than actors and godmen.)\n\nTL;DR : This country is fucked up and full of pseudo science. Nobody in at least a few decades can reverse this idiocy.\n\nSorry for the long post and I know this sounds like a massive rant but this is very frustrating and I\'m totally venting this out.\n\nAlso, make sure you try not to ask a scientist to stay back and work here.\n\nCheers! :) I hope butthurt idiots don\'t read this or I\'ll be lynched. \n\n-A\n\n'",6o5rl5
Anti-nationa... oh wait.,ilovethewayyousmile,1498114394.0,620,Policy/Economy,i.redd.it,'',6iruox
"Since mountain dogs are doing the rounds, meet my majestic friend",FireEjaculator,1499669893.0,618,Non-Political,imgur.com,'',6mcus2
Annual Reddit Meetup ~ Kolkata,biswassumit25,1497749634.0,612,Non-Political,imgur.com,'',6hx4xn
Two-year-olds in Mumbai are taking coaching to clear nursery admissions,Sunapr1,1488173696.0,610,Non-Political,indiatoday.intoday.in,'',5wf069
I made a chrome extension which detects clickbaits right inside Facebook using deep learning and I thought maybe you all at /r/india would like try it and give some feedback.,irahulkapoor,1485837247.0,611,[R]eddiquette,github.com,'',5r637u
India: the trilogy,KnightArts,1494747266.0,607,Non-Political,i.imgur.com,'',6b2s7a
"Head of iSpirt caught using anonymous troll accounts on Twitter to attack and discredit those criticizing Aadhaar. (iSpirt at the folks behind India Stack, the tech in Aadhaar/UPI/e-KYC)",karthikb351,1495174671.0,603,Politics,self.india,"""All the details here: https://medium.com/@jackerhack/inside-the-mind-of-indias-chief-tech-stack-evangelist-ca01e7a507a9\n\nand here: https://medium.com/@jackerhack/sharad-sharmas-dubious-denial-b0b9aa6c6b8f\n\n**TL;DR**\n\n*  Some anonymous Twitter accounts pop up about 15 days ago and keep heckling those critical of Aadhaar, and even going so far as to spread lies about the companies they work for.\n*  These accounts kept bumping into each other in conversations, and they follow/like/RT each other's tweets. It was obvious they were all related and coordinating.\n*  Lightbulb moment when both Sharad Sharma(who is the head and co-founder of iSpirt) and one of the troll accounts made similar arguments in a Twitter thread.\n*  Someone then leaked a slide deck that iSpirt had made that detailed their playbook on how to deal with those criticizing Aadhaar. It clearly shows them classifying critics and coordinating on WhatsApp.\n*  Some digging revealed that one of the troll accounts was linked to Sharad's mobile number.\n*  After multiple people verified the same thing, Sharad responded saying he didn't know how his number got attached to troll account and that he categorically denies tweeting from it.\n*  Except he accidentally tweeted that denial from one of the other troll accounts and quickly deleted it, but not before someone could get a screenshot of it.\n\nThis is a big deal because iSpirt is a massive industry body, with Nandan Nilekani as their mentor, and lots of donors from across the software industry.\n\nhttp://www.ispirt.in/who-we-are/Our-Donors\n\nI can't get over the irony of those behind Aadhaar making *anonymous* Twitter accounts to push their agenda and using cheap tactics like personal attacks to stop those criticizing it.""",6c1xp3
Do you guys know any people hoarding lots of blackmoney and affected? Tell us the stories,ARflash,1478700345.0,607,AskIndia,self.india,'we want to know how they are raging hard. \n\nMy relatives whatsapp group is unusually silent now. haha.',5c195e
Tamil Nadu CM Jayalalitha has passed away,2EyedRaven,1480939267.0,599,[R]eddiquette,self.india,"'Tamil News channels Thanthi TV and Puthiya Tazhaimurai announced it.\n\n**EDIT: Now lot of news channels are reporting that she is alive. It is a good thing, obviously, if she is alive. See stickied comment below for more info**\n\n**EDIT2: RIP**'",5gljox
Our Boss just lashed out on a temp for making a very insignificant error and unleashed some back in the days knowledge.. I did the math and comparision.,DemonRyuX,1493700275.0,597,Non-Political,i.redd.it,'',68r4y2
"Calls it ‘grave injustice’, goes to SC: Man refuses to obtain Aadhaar for self, family. Son denied college admission, hospital treatment without it",8uid,1505709218.0,596,Policy/Economy,indianexpress.com,'',70sqgn
"75,000+ kms of train journey made me realize few uplifting things about Indians: We are compassionate, kind hearted and often, generous..",wordswithmagic,1488440994.0,593,Non-Political,self.india,"""I am from Lucknow, studied in Mangalore for 5 years. Used to travel to-and-fro atleast 3 times a year by train, and it is a 2500 kms distance. \n\nWhile travelling across UP, MP, Maharashtra, Goa, Karnataka, Andhra Pradesh and sometimes Tamil Nadu, I realized few uplifting facts: We Indians are compassionate, we are kind-hearted and often generous as well.\n\nFour incidents to prove my point:\n\n- Once, I forgot to bring along my damn ticket. IRCTC website hadn't yet comeup, and it was still the physical ticket which ruled. The journey was from Mumbai to Mangalore via Matyagandha Express, and the ticket checker was a Muslim from Mumbai with heavy beard. I showed him my college ID, hostel pictures (actual album.. there was no mobile in 2000), told him my story, and even asked his address so that I can send him the penalty later. He not only offered me his own berth (Side-upper), but also offered me tea, lunch and some money so that I can reach my hostel safely. \n\n- Once near Jhansi, a man was sitting on the lower berth, and suddenly the glass window fell down, without any warning. His fingers received the impact, and they started bleeding. A young Hindu rural women, with veil covering her head, and mehendi dotting her hands (most probably newly married), stood up, removed the veil, tore a piece of cloth from ther luggage, and before anyone can react, started tightening the bleeding fingers. She went to adjacent coaches, brought an antiseptic, and applied that so that there is no freaking infection. Personally, it was a very touching moment for me. \n\n- I was travelling with a female friend, and she was sleeping since last 15 hours, on the upper berth. The train passed Mangalore, crossed Madgaon,. reached Mumbai, and she was still sleeping like a log. I was in lower berth, reading a book. I was alone having food and stuff, while she kept on sleeping. My neibhours, an aged couple with a grown up girl couldn't stop themselves. The lady poked me, asked if everything is fine with the girl who is sleeping since last 15 hours. I said yes, fine. She is a chronic sleeper, I said. And I also said thank you for the concern. \n\n- I was somewhere between Coimbatore and Chennai, and had no money to buy food. The train change was at Chennai, and one of my friends was supposed to meet me, and give me some money for the journey. A muslim family checked in, somewhere in between, with huge vessels carrying biryani and raita and stuff. Right in front of me, they started eating it, as the delicious aroma filled the compartment. They offered me thrice, and on the fourth attempt, I said yes. The satisfaction from eating biryani after 10 hours of fasting left a lasting impression on my psyche. I remember that when I went into the bathroom, I had tears in my eyes. \n\nYes, sometimes we do act strange, but trust me, overall we are nice bunch of people. India rocks!\n\nEdit: Thanks for the Gold, O stranger! Reddit has been way too kind on me. Feeling blessed. """,5x1zma
"Beautiful India (Day 3) : Dawki,Meghalaya.",Abzone7n,1478969890.0,592,Scheduled,i.redd.it,'',5cl92g
sexist google,My_name_is_Lost,1503220853.0,595,Non-Political,imgur.com,'',6uuu6k
The Hindu just posted this (NSFW),searchingpeace,1484366836.0,590,Non-Political,imgur.com,'',5nvhqd
Petrol stations won't accept cards from Monday to protest bank's transaction fee,hipporama,1483864573.0,593,Demonetization,m.timesofindia.com,'',5mpyhv
Pankaj Advani wins World Billiards Championships title,4ed8c03dd6726ec4tr,1481594668.0,598,Sports,timesofindia.indiatimes.com,'',5i0wb5
"No money for ambulance, Hyderabad beggar carries wife's corpse for 60 km in a pushcart",dheerajdeekay,1478429391.0,593,Non-Political,thenewsminute.com,'',5bf7xj
Stephen King's It passed by CBFC with no cuts; Warner Bros-India thank Prasoon Joshi,have_another_upvote,1504449243.0,590,Politics,firstpost.com,'',6xtgee
I look at this picture whenever I think life has been unfair to me,stochastic_zeitgeist,1503118204.0,586,Non-Political,4.bp.blogspot.com,'',6un6vn
BJP claims Modi made Kochi Metro a reality; project was started by Manmohan Singh,sanskaridaddy,1497676258.0,590,Politics,hindustantimes.com,'',6hrpkf
meanwhile,proSpsheets,1496379809.0,588,Politics,pbs.twimg.com,'',6esdbe
Was going through flats for Rental on a website. They had some funny House Rules. Hilarious!,,1493948705.0,590,Non-Political,i.redd.it,'',69bv2e
"Such ministers exist too: Prof. C. Raveendranath, Minister for Education, Kerala. As a college professor, a bicycle was his preferred mode of travel. Recently, his son got married in a small ceremony at a tiny hall holding 200. No invitation card was printed. Food was served by locals.",rajeevist,1499679587.0,590,Politics,imgur.com,'',6mdff3
"Tom Alter, Padma Shri actor and writer, dies aged 67",thisisshantzz,1506735714.0,589,Non-Political,timesofindia.indiatimes.com,'',73c9jn
India Invites American Who took Bullets for Two Indians in Kansas,Narendras11,1488572119.0,581,Non-Political,news18.com,'',5xcprp
